{
  "$schema": "https://json-schema.org/draft/2020-12/schema",
  "type": "object",
  "properties": {
    "source": {
      "type": "string"
    },
    "status": {
      "type": "string",
      "enum": [
        "complete",
        "void",
        "ok",
        "stale",
        "failed",
        "unavailable",
        "validated",
        "reproducible",
        "unvalidated",
        "withdrawn"
      ]
    },
    "last_success_utc": {
      "anyOf": [
        {
          "type": "string",
          "pattern": "^\\d{4}-\\d{2}-\\d{2}T\\d{2}:\\d{2}:\\d{2}(\\.\\d+)?Z$"
        },
        {
          "type": "null"
        }
      ]
    },
    "detail": {
      "type": [
        "string",
        "null"
      ]
    }
  },
  "required": [
    "source",
    "status"
  ],
  "additionalProperties": false
}
