[{"source":"nflverse_schedules","status":"ok","last_success_utc":"2026-10-03T12:00:00Z","detail":"schedule, scores and consensus closing lines via nflreadr"},{"source":"injury_reports","status":"ok","last_success_utc":"2026-10-03T12:00:00Z","detail":"injury reports: tracker status 'full'"},{"source":"weather","status":"stale","last_success_utc":"2026-10-03T12:00:00Z","detail":"game-day weather: tracker status 'partial_fallback'; fallback weather for 2024_15_BAL_NYG"},{"source":"market_lines","status":"stale","last_success_utc":"2026-10-03T12:00:00Z","detail":"closing moneylines: tracker status 'partial'; no market line for 2024_15_BUF_DET; C3 unshrunk (no market): 2024_15_BUF_DET"}]
